Criteria,Weight,Score 4,Score 3,Score 2,Score 1
Content Quality & Technical Depth,0.2,Demonstrates comprehensive and nuanced understanding of AI/DS concepts; makes sophisticated connections between ideas,Demonstrates solid understanding of core concepts; makes appropriate connections between related ideas,Demonstrates partial understanding of concepts; connections between ideas are limited or unclear,Demonstrates minimal understanding; significant misconceptions present; lacks meaningful connections
Technical Accuracy,0.2,All technical information is accurate and precise; uses terminology correctly and appropriately,Technical information is mostly accurate; minor errors do not impact overall understanding,Some technical inaccuracies present; errors partially impact understanding of the response,Significant technical errors; incorrect use of terminology undermines the response
Reasoning & Justification,0.2,"Provides clear, logical reasoning with strong evidence or examples; justifications are compelling and well-supported",Provides adequate reasoning with relevant evidence; justifications are clear and appropriate,Reasoning is present but incomplete; evidence or examples are limited or weakly connected,Reasoning is unclear or absent; lacks evidence or examples to support claims
Problem-Solving Approach,0.2,"Applies an effective, systematic approach; considers multiple perspectives or solutions; demonstrates critical thinking",Applies a reasonable approach to the problem; shows logical thinking with some consideration of alternatives,Approach is partially effective; problem-solving steps are incomplete or disorganized,Approach is ineffective or absent; does not demonstrate systematic problem-solving
Communication & Clarity,0.2,"Response is exceptionally clear, well-organized, and easy to follow; ideas flow logically",Response is clear and organized; ideas are presented in a logical sequence,Response is somewhat unclear; organization could be improved; some ideas are difficult to follow,Response is unclear and disorganized; difficult to understand the main points